Feminicidio.net,https://ciencia-ciudadana.es/proyecto-cc/feminicidio-net/,"Ciencias Sociales, Informática y Ciencias de la Computación, Medicina y Salud","Feminicidio.net es un proyecto sin fines de lucro de la asociación Otro Tiempo. Por un lado, es un portal de noticias con perspectiva de género que se nutre de la elaboración propia de reportajes, entrevistas, artículos, investigaciones especiales e informes sobre feminicidio y violencia de género por países de Iberoamérica. También publicamos noticias de otros medios de comunicación on line. Por otro lado, hemos creado la Base de Datos Feminicidio en Iberoamérica, destinada a documentar los asesinatos de mujeres por razón de género de 21 países, tanto casos particulares y paradigmáticos como recuentos globales por Estados. Documentación constituye la tercera columna vertebral de la estructura de contenidos de Feminicidio.net. En dicha sección difundimos artículos, ensayos, informes, estudios, guías, manuales, normativa por países, recomendaciones, resoluciones y sanciones a los Estados sobre los siguientes temas: feminicidio-femicidio, violencia de género, tráfico de personas con fines de explotación sexual e igualdad.
",,"nanFeminicidio.net es un proyecto sin fines de lucro de la asociación Otro Tiempo. Por un lado, es un portal de noticias con perspectiva de género que se nutre de la elaboración propia de reportajes, entrevistas, artículos, investigaciones especiales e informes sobre feminicidio y violencia de género por países de Iberoamérica. También publicamos noticias de otros medios de comunicación on line. Por otro lado, hemos creado la Base de Datos Feminicidio en Iberoamérica, destinada a documentar los asesinatos de mujeres por razón de género de 21 países, tanto casos particulares y paradigmáticos como recuentos globales por Estados. Documentación constituye la tercera columna vertebral de la estructura de contenidos de Feminicidio.net. En dicha sección difundimos artículos, ensayos, informes, estudios, guías, manuales, normativa por países, recomendaciones, resoluciones y sanciones a los Estados sobre los siguientes temas: feminicidio-femicidio, violencia de género, tráfico de personas con fines de explotación sexual e igualdad.
",Observatorio de la Ciencia Ciudadana en España,https://ciencia-ciudadana.es/proyecto-cc/
Autofabricantes,https://ciencia-ciudadana.es/proyecto-cc/autofabricantes/,"Ecología y Medioambiente, Informática y Ciencias de la Computación, Medicina y Salud","Autofabricantes lleva a cabo la autofabricación colectiva de prótesis personales en código abierto. La iniciativa se ha marcado como objetivo trabajar en una alternativa al panorama reinante en el sector protésico español. Para ello propone un proceso de búsqueda de nuevos avances teóricos y técnicos en la autofabricación colectiva de prótesis apoyándose en la impresión 3D, además de tejer y generar las redes entre comunidades de apoyo/fabricación y las familias afectadas. El colectivo está trabajando actualmente en una prótesis de código abierto fabricada con impresión 3D y compuesta de un sistema electrónico de tres sensores de movimiento y tres motores. Además, Autofabricantes trabaja en otros dos proyectos de adaptabilidad encargados por dos familias afectadas afines al proyecto.
",,"nanAutofabricantes lleva a cabo la autofabricación colectiva de prótesis personales en código abierto. La iniciativa se ha marcado como objetivo trabajar en una alternativa al panorama reinante en el sector protésico español. Para ello propone un proceso de búsqueda de nuevos avances teóricos y técnicos en la autofabricación colectiva de prótesis apoyándose en la impresión 3D, además de tejer y generar las redes entre comunidades de apoyo/fabricación y las familias afectadas. El colectivo está trabajando actualmente en una prótesis de código abierto fabricada con impresión 3D y compuesta de un sistema electrónico de tres sensores de movimiento y tres motores. Además, Autofabricantes trabaja en otros dos proyectos de adaptabilidad encargados por dos familias afectadas afines al proyecto.
",Observatorio de la Ciencia Ciudadana en España,https://ciencia-ciudadana.es/proyecto-cc/
Cadáveres inmobiliarios,https://ciencia-ciudadana.es/proyecto-cc/cadaveres-inmobiliarios/,"Ciencias Sociales, Cultura y Arqueología","Cadáveres inmobiliarios es una plataforma que recopila de forma participativa proyectos arquitectónicos y urbanísticos inacabados, infrautilizados o vacíos a los que llama «Cadáveres inmobiliarios» y que reflejan las consecuencias materiales más inmediatas de la burbuja inmobiliaria en España. Ante la inexistencia de un inventario oficial, la plataforma trata de construir una base de datos de forma colectiva que permita la localización y documentación de todos estos desarrollos que no llegaron a verse terminados. Esta iniciativa es de marcado carácter interdisciplinar, englobando arquitectos, ingenieros, urbanistas, investigadores, artistas o activistas medioambientales e invita a la participación al mayor número de personas posible. La plataforma trabaja en el objetivo de proporcionar información exhaustiva de manera accesible para que cada cual la utilice acorde con sus intereses. Aunque el mero hecho de informar sobre este fenómeno supone una crítica implícita al modelo de desarrollo basado en el ladrillo, Cadáveres Inmobiliarios pretende ser el punto de partida para futuros proyectos que propongan soluciones a la situación de estancamiento que padecen estos desarrollos urbanísticos, fomentando así una concienciación social sobre una situación que entienden como inapropiada. Para ello la plataforma ha producido una cartografía de “Cadáveres Inmobiliarios” en el territorio español y una base de datos, ambas son de acceso abierto. Además, la plataforma da las claves para conocer el proceso de creación de una base de datos pública de cadáveres inmobiliarios.
",,"nanCadáveres inmobiliarios es una plataforma que recopila de forma participativa proyectos arquitectónicos y urbanísticos inacabados, infrautilizados o vacíos a los que llama «Cadáveres inmobiliarios» y que reflejan las consecuencias materiales más inmediatas de la burbuja inmobiliaria en España. Ante la inexistencia de un inventario oficial, la plataforma trata de construir una base de datos de forma colectiva que permita la localización y documentación de todos estos desarrollos que no llegaron a verse terminados. Esta iniciativa es de marcado carácter interdisciplinar, englobando arquitectos, ingenieros, urbanistas, investigadores, artistas o activistas medioambientales e invita a la participación al mayor número de personas posible. La plataforma trabaja en el objetivo de proporcionar información exhaustiva de manera accesible para que cada cual la utilice acorde con sus intereses. Aunque el mero hecho de informar sobre este fenómeno supone una crítica implícita al modelo de desarrollo basado en el ladrillo, Cadáveres Inmobiliarios pretende ser el punto de partida para futuros proyectos que propongan soluciones a la situación de estancamiento que padecen estos desarrollos urbanísticos, fomentando así una concienciación social sobre una situación que entienden como inapropiada. Para ello la plataforma ha producido una cartografía de “Cadáveres Inmobiliarios” en el territorio español y una base de datos, ambas son de acceso abierto. Además, la plataforma da las claves para conocer el proceso de creación de una base de datos pública de cadáveres inmobiliarios.
",Observatorio de la Ciencia Ciudadana en España,https://ciencia-ciudadana.es/proyecto-cc/
"Sociedad Ibérica para el Estudio y la Conservación de los Ecosistemas (SIECE),",https://ciencia-ciudadana.es/proyecto-cc/sociedad-iberica-para-el-estudio-y-la-conservacion-de-los-ecosistemas-siece/,"Biodiversidad, Ecología y Medioambiente, Informática y Ciencias de la Computación","La Sociedad Ibérica para el Estudio y la Conservación de los Ecosistemas (SIECE), con sede en Jaén, nace a finales de 2011 con el ánimo de contribuir al estudio y conservación de los valores naturales de nuestro territorio bajo el paradigma del desarrollo sostenible. Pretendemos aportar conocimiento y custodiar los ecosistemas y la biodiversidad, de los que formamos parte. El carácter integrador de SIECE permite acoger distintas percepciones de las personas que se quieran implicar en el estudio y la conservación del medio ambiente. A principios de 2015 pusimos en marcha el proyecto PON UN TENDIDO EN TU PUNTO DE MIRA
http://sostendidos.blogspot.com.es . Con esta acción, pretendemos crear un inventario de tendidos eléctricos potencialmente peligrosos para las aves a través de una red de voluntarios, con el objetivo de llamar atención sobre el problema a compañías eléctricas y administraciones públicas, y exigir que se corrijan. El proyecto cuenta con un mapa donde están geolocalizados y descritos los tendidos y postes con electrocuciones o colisiones de aves, que la red de voluntarios del proyecto PON UN TENDIDO EN TU PUNTO DE MIRA hemos prospectado hasta el momento. Pulsando sobre los diferentes iconos del mapa se puede tener más información sobre el tendido o poste, así como las especies electrocutadas, en caso de haberlas.
",,"nanLa Sociedad Ibérica para el Estudio y la Conservación de los Ecosistemas (SIECE), con sede en Jaén, nace a finales de 2011 con el ánimo de contribuir al estudio y conservación de los valores naturales de nuestro territorio bajo el paradigma del desarrollo sostenible. Pretendemos aportar conocimiento y custodiar los ecosistemas y la biodiversidad, de los que formamos parte. El carácter integrador de SIECE permite acoger distintas percepciones de las personas que se quieran implicar en el estudio y la conservación del medio ambiente. A principios de 2015 pusimos en marcha el proyecto PON UN TENDIDO EN TU PUNTO DE MIRA
http://sostendidos.blogspot.com.es . Con esta acción, pretendemos crear un inventario de tendidos eléctricos potencialmente peligrosos para las aves a través de una red de voluntarios, con el objetivo de llamar atención sobre el problema a compañías eléctricas y administraciones públicas, y exigir que se corrijan. El proyecto cuenta con un mapa donde están geolocalizados y descritos los tendidos y postes con electrocuciones o colisiones de aves, que la red de voluntarios del proyecto PON UN TENDIDO EN TU PUNTO DE MIRA hemos prospectado hasta el momento. Pulsando sobre los diferentes iconos del mapa se puede tener más información sobre el tendido o poste, así como las especies electrocutadas, en caso de haberlas.
",Observatorio de la Ciencia Ciudadana en España,https://ciencia-ciudadana.es/proyecto-cc/
Milmots,https://ciencia-ciudadana.es/proyecto-cc/milmots/,"Ciencias Sociales, Informática y Ciencias de la Computación","Milmots recolecta palabras y locuciones en las distintas variantes del catalán. No importa cuál sea el origen de los participantes ni su lengua madre, las palabras viven donde hay alguien que las conoce. Además de difundir y conocer el léxico, el objetivo del proyecto es analizar, desde el punto de vista de la sociolingüística, aspectos como: la difusión y supervivencia de las palabras; la conexión lingüística entre poblaciones; la madurez y corrección del léxico en función de la edad, del grupo social y del área geográfica, etc.
",,"nanMilmots recolecta palabras y locuciones en las distintas variantes del catalán. No importa cuál sea el origen de los participantes ni su lengua madre, las palabras viven donde hay alguien que las conoce. Además de difundir y conocer el léxico, el objetivo del proyecto es analizar, desde el punto de vista de la sociolingüística, aspectos como: la difusión y supervivencia de las palabras; la conexión lingüística entre poblaciones; la madurez y corrección del léxico en función de la edad, del grupo social y del área geográfica, etc.
",Observatorio de la Ciencia Ciudadana en España,https://ciencia-ciudadana.es/proyecto-cc/
Campamentos científicos,https://ciencia-ciudadana.es/proyecto-cc/campamentos-cientificos/,"Biodiversidad, Ciencias Sociales, Ecología y Medioambiente, Espacio y Astronomía, Informática y Ciencias de la Computación","Campamentos científicos son iniciativas que llevamos a cabo en colaboración con diferentes instituciones nacionales para favorecer que desde edades tempranas la ciencia resulte atractiva.
",,"nanCampamentos científicos son iniciativas que llevamos a cabo en colaboración con diferentes instituciones nacionales para favorecer que desde edades tempranas la ciencia resulte atractiva.
",Observatorio de la Ciencia Ciudadana en España,https://ciencia-ciudadana.es/proyecto-cc/
ESCIENCIA,https://ciencia-ciudadana.es/proyecto-cc/esciencia/,"Ciencias Sociales, Informática y Ciencias de la Computación","ESCIENCIA está especializada en la divulgación de la ciencia. Coordina proyectos donde el ciudadano participa de forma activa de la actividad investigadora. Diseñamos herramientas novedosas para generar nuevas interacciones entre el público y el contenido científico.
",,"nanESCIENCIA está especializada en la divulgación de la ciencia. Coordina proyectos donde el ciudadano participa de forma activa de la actividad investigadora. Diseñamos herramientas novedosas para generar nuevas interacciones entre el público y el contenido científico.
",Observatorio de la Ciencia Ciudadana en España,https://ciencia-ciudadana.es/proyecto-cc/
Melanogaster: catch the fly!,https://ciencia-ciudadana.es/proyecto-cc/melanogaster-catch-the-fly/,"Biodiversidad, Ecología y Medioambiente, Medicina y Salud","Dra. Josefa González (investigadora principal de González Lab), y miembros de su equipo visitarán Tomelloso y Baza para colectar ejemplares de la mosca de la fruta junto con estudiantes y profesores de los institutos IES Eladio Cabañero e IES José de Mora, respectivamente. Los participantes clasificarán los ejemplares colectados en sus centros de estudio, los prepararán para enviarlos a secuenciar y, posteriormente, podrán participar en el análisis de las secuencias genómicas generadas. González Lab y la plataforma de divulgación científica La Ciencia en Tu Mundo (LCATM) han preparado materiales didácticos sobre conceptos de biología y genética para que profesores y estudiantes se preparen antes de las colectas y están trabajando en la generación de unos módulos que faciliten la participación de los centros educativos en el posterior análisis de las secuencias genómicas.
",,"nanDra. Josefa González (investigadora principal de González Lab), y miembros de su equipo visitarán Tomelloso y Baza para colectar ejemplares de la mosca de la fruta junto con estudiantes y profesores de los institutos IES Eladio Cabañero e IES José de Mora, respectivamente. Los participantes clasificarán los ejemplares colectados en sus centros de estudio, los prepararán para enviarlos a secuenciar y, posteriormente, podrán participar en el análisis de las secuencias genómicas generadas. González Lab y la plataforma de divulgación científica La Ciencia en Tu Mundo (LCATM) han preparado materiales didácticos sobre conceptos de biología y genética para que profesores y estudiantes se preparen antes de las colectas y están trabajando en la generación de unos módulos que faciliten la participación de los centros educativos en el posterior análisis de las secuencias genómicas.
",Observatorio de la Ciencia Ciudadana en España,https://ciencia-ciudadana.es/proyecto-cc/
MalariaSpot,https://ciencia-ciudadana.es/proyecto-cc/malariaspot/,"Biodiversidad, Ecología y Medioambiente, Insectos y Polinizadores, Medicina y Salud","La malaria es una de las amenazas más graves para la salud global. En la actualidad, la manera estándar de diagnosticar esta enfermedad (con más de 200 millones casos de malaria al año y que mata a medio millón de personas) consiste contar el número de parásitos en muestras de sangre utilizando un microscopio. Un proceso que puede requerir hasta 30 minutos. Y no hay suficientes especialistas en el mundo para diagnosticar todos los casos de malaria. MalariaSpot es un proyecto que quiere solucionar este problema con la participación ciudadana. Convertimos el proceso de diagnóstico en un videojuego e investigamos técnicas para combinar resultados de jugadores de forma que obtengamos un resultado fiable. La primera investigación fue con MalariaSpot en 2012. Aplicamos la idea a Tuberculosis en 2014 con el juego TuberSpot. Y ahora lanzamos MalariaSpot Bubbles para tratar de diferenciar entre las distintas especies de parásitos.
",,"nanLa malaria es una de las amenazas más graves para la salud global. En la actualidad, la manera estándar de diagnosticar esta enfermedad (con más de 200 millones casos de malaria al año y que mata a medio millón de personas) consiste contar el número de parásitos en muestras de sangre utilizando un microscopio. Un proceso que puede requerir hasta 30 minutos. Y no hay suficientes especialistas en el mundo para diagnosticar todos los casos de malaria. MalariaSpot es un proyecto que quiere solucionar este problema con la participación ciudadana. Convertimos el proceso de diagnóstico en un videojuego e investigamos técnicas para combinar resultados de jugadores de forma que obtengamos un resultado fiable. La primera investigación fue con MalariaSpot en 2012. Aplicamos la idea a Tuberculosis en 2014 con el juego TuberSpot. Y ahora lanzamos MalariaSpot Bubbles para tratar de diferenciar entre las distintas especies de parásitos.
",Observatorio de la Ciencia Ciudadana en España,https://ciencia-ciudadana.es/proyecto-cc/
Convocatoria CeSAr-Etopia Labs,https://ciencia-ciudadana.es/proyecto-cc/convocatoria-cesar-etopia-labs/,"Biología, Ciencias Sociales, Ecología y Medioambiente, Educación, Sonido","La Universidad de Zaragoza, con el Instituto Universitario de Investigación BIFI, y el Ayuntamiento de Zaragoza, en colaboración con la Fundación Zaragoza Ciudad del Conocimiento y la Fundación Ibercivis, lanzan la I Convocatoria CeSAr-Etopia Labs, con el fin de seleccionar hasta 8 proyectos impulsados por la ciudadanía para su desarrollo en los Laboratorios CeSAr en Etopia Centro de Arte y Tecnología. Esta convocatoria es posible gracias al acuerdo entre la Universidad de Zaragoza y el Ayuntamiento de la ciudad por el cual, y a través de un programa FEDER, se dotaron, durante el pasado año, los laboratorios de Etopia con equipamientos técnicos del Instituto de Biocomputación y Física de Sistemas Complejos (BIFI) con el objetivo de impulsar la investigación en ciencia ciudadana, acercar la ciencia, la creatividad tecnológica y el arte con nuevos medios a la ciudadanía, favorecer el conocimiento colaborativo y consolidar Etopia como centro de producción de proyectos multidisciplinares.
",,"nanLa Universidad de Zaragoza, con el Instituto Universitario de Investigación BIFI, y el Ayuntamiento de Zaragoza, en colaboración con la Fundación Zaragoza Ciudad del Conocimiento y la Fundación Ibercivis, lanzan la I Convocatoria CeSAr-Etopia Labs, con el fin de seleccionar hasta 8 proyectos impulsados por la ciudadanía para su desarrollo en los Laboratorios CeSAr en Etopia Centro de Arte y Tecnología. Esta convocatoria es posible gracias al acuerdo entre la Universidad de Zaragoza y el Ayuntamiento de la ciudad por el cual, y a través de un programa FEDER, se dotaron, durante el pasado año, los laboratorios de Etopia con equipamientos técnicos del Instituto de Biocomputación y Física de Sistemas Complejos (BIFI) con el objetivo de impulsar la investigación en ciencia ciudadana, acercar la ciencia, la creatividad tecnológica y el arte con nuevos medios a la ciudadanía, favorecer el conocimiento colaborativo y consolidar Etopia como centro de producción de proyectos multidisciplinares.
",Observatorio de la Ciencia Ciudadana en España,https://ciencia-ciudadana.es/proyecto-cc/
Fundación Española para la Ciencia y la Tecnología,https://ciencia-ciudadana.es/proyecto-cc/fundacion-espanola-para-la-ciencia-y-la-tecnologia/,"Animales, Biodiversidad, Biogeografía, Biología, Ciencia de los Alimentos, Ciencias de la Agricultura y Veterinaria, Ciencias Políticas, Ciencias Químicas, Ciencias Sociales, Clima y Meteorología, Cultura y Arqueología, Culturas Indígenas, Ecología y Medioambiente, Educación, Espacio y Astronomía, Física, Genética, Geografía, Geología y Ciencias de la Tierra, Gestión de Recursos Naturales, Informática y Ciencias de la Computación, Insectos y Polinizadores, Medicina y Salud, Naturaleza y Aire Libre, Océanos, Agua, Marino y Terrestre, Pájaros, Seguimiento de Especies a largo plazo, Sonido, Transporte","La finalidad de las actuaciones objeto de estas ayudas, de acuerdo con los objetivos de la FECYT, es: a. Incrementar la cultura científica, tecnológica e innovadora de la sociedad española. b. Incrementar la difusión de los resultados de investigación científico-técnica y de la innovación financiados con fondos públicos. c. Fomentar e incentivar el acercamiento de la ciencia, la tecnología y la innovación a los ciudadanos acortando distancias entre el mundo científico y tecnológico y la sociedad en general. d. Mejorar la educación científico–técnica de la sociedad en todos los niveles. e. Impulsar la participación activa de la sociedad en actividades de divulgación científica.
",,"nanLa finalidad de las actuaciones objeto de estas ayudas, de acuerdo con los objetivos de la FECYT, es: a. Incrementar la cultura científica, tecnológica e innovadora de la sociedad española. b. Incrementar la difusión de los resultados de investigación científico-técnica y de la innovación financiados con fondos públicos. c. Fomentar e incentivar el acercamiento de la ciencia, la tecnología y la innovación a los ciudadanos acortando distancias entre el mundo científico y tecnológico y la sociedad en general. d. Mejorar la educación científico–técnica de la sociedad en todos los niveles. e. Impulsar la participación activa de la sociedad en actividades de divulgación científica.
",Observatorio de la Ciencia Ciudadana en España,https://ciencia-ciudadana.es/proyecto-cc/
Asociación Fotografía y Biodiversidad,https://ciencia-ciudadana.es/proyecto-cc/asociacion-fotografia-y-biodiversidad/,"Biodiversidad, Biología, Pájaros","La Asociación Fotografía y Biodiversidad gestiona la plataforma on-line de trabajo colaborativo www.biodiversidadvirtual.org. En ella más de 3000 naturalistas comparten sus fotografias digitales geolocalizadas y un equipo de administradores y especialistas las organizan taxonómicamente para consulta libre de más de un millón de visitas al mes. Esta asociación deriva parte de los recursos también a actividades de divulgación , concienciación , protección y conocimiento de la biodiversidad.
",,"nanLa Asociación Fotografía y Biodiversidad gestiona la plataforma on-line de trabajo colaborativo www.biodiversidadvirtual.org. En ella más de 3000 naturalistas comparten sus fotografias digitales geolocalizadas y un equipo de administradores y especialistas las organizan taxonómicamente para consulta libre de más de un millón de visitas al mes. Esta asociación deriva parte de los recursos también a actividades de divulgación , concienciación , protección y conocimiento de la biodiversidad.
",Observatorio de la Ciencia Ciudadana en España,https://ciencia-ciudadana.es/proyecto-cc/
Natusfera,https://ciencia-ciudadana.es/proyecto-cc/natusfera/,"Biodiversidad, Ecología y Medioambiente, Informática y Ciencias de la Computación","Natusfera es una adaptación de iNaturalist desarrollada por el CREAF. Está financiada por la FECYT, Fundación Española para la Ciencia y la Tecnología (www.fecyt.es), Obra Social “La Caixa” (https://obrasociallacaixa.org/es/home), el Nodo Nacional de Biodiversidad en España, GBIF.ES (www.gbif.es) y el Instituto de Ciencias del Mar (www.icm.csic.es). La administración, coordinación, mantenimiento y gestión de los contenidos se realiza a través del CREAF y GBIF.ES.
Es importante resaltar que Natusfera no es un proyecto como tal, sino que es una plataforma de proyectos.
",,"nanNatusfera es una adaptación de iNaturalist desarrollada por el CREAF. Está financiada por la FECYT, Fundación Española para la Ciencia y la Tecnología (www.fecyt.es), Obra Social “La Caixa” (https://obrasociallacaixa.org/es/home), el Nodo Nacional de Biodiversidad en España, GBIF.ES (www.gbif.es) y el Instituto de Ciencias del Mar (www.icm.csic.es). La administración, coordinación, mantenimiento y gestión de los contenidos se realiza a través del CREAF y GBIF.ES.
Es importante resaltar que Natusfera no es un proyecto como tal, sino que es una plataforma de proyectos.
",Observatorio de la Ciencia Ciudadana en España,https://ciencia-ciudadana.es/proyecto-cc/
&DIGITALFAB,https://ciencia-ciudadana.es/proyecto-cc/digitalfab/,"Biodiversidad, Ciencias Sociales, Ecología y Medioambiente","Recogida de datos sensoriales sobre la calidad del aire Zaragozano y el polen para curso de representación de datos.
",,"nanRecogida de datos sensoriales sobre la calidad del aire Zaragozano y el polen para curso de representación de datos.
",Observatorio de la Ciencia Ciudadana en España,https://ciencia-ciudadana.es/proyecto-cc/
