Observatorio Ciudadano de la Sequía,https://ciencia-ciudadana.es/proyecto-cc/observatorio-ciudadano-de-la-sequia/,"Ciencias Sociales, Clima y Meteorología, Ecología y Medioambiente, Geografía, Gestión de Recursos Naturales, Informática y Ciencias de la Computación, Océanos, Agua, Marino y Terrestre","El Observatorio Ciudadano de la Sequía facilita el acceso a información sobre gestión y planificación del agua y de las sequías, y se construye como un lugar de encuentro de distintas disciplinas y saberes, que pretende facilitar el fortalecimiento social e institucional mediante la coproducción del conocimiento. Gracias a la comunidad articulada en torno al Observatorio se podrán calcular indicadores de vulnerabilidad al riesgo de sequía —que se han demostrado claves para su completa comprensión— y se evaluarán distintas alternativas de gestión del agua y de la sequía. Con ello no solo se genera nuevo conocimiento sino también opiniones informadas que mejorarán la calidad del debate público sobre la materia. Para facilitar y fortalecer la participación de ciudadanos, responsables de gestión, colectivos profesionales y comunidad científica, se han desarrollado nuevas herramientas basadas en tecnologías de información geográfica, aplicaciones web e inteligencia artificial.
","El Observatorio Ciudadano de la Sequía es un portal de ciencia ciudadana para avanzar en el mejor conocimiento del riesgo de sequía en España. Para ello, propone una nueva metodología que favorece el trabajo deliberativo y colaborativo, facilita una participación pública activa y real y mejora los procesos de toma de decisiones en materia de gestión del agua y de la sequía y, en definitiva, el necesario diálogo entre la ciencia, la política y la sociedad.","El Observatorio Ciudadano de la Sequía es un portal de ciencia ciudadana para avanzar en el mejor conocimiento del riesgo de sequía en España. Para ello, propone una nueva metodología que favorece el trabajo deliberativo y colaborativo, facilita una participación pública activa y real y mejora los procesos de toma de decisiones en materia de gestión del agua y de la sequía y, en definitiva, el necesario diálogo entre la ciencia, la política y la sociedad.El Observatorio Ciudadano de la Sequía facilita el acceso a información sobre gestión y planificación del agua y de las sequías, y se construye como un lugar de encuentro de distintas disciplinas y saberes, que pretende facilitar el fortalecimiento social e institucional mediante la coproducción del conocimiento. Gracias a la comunidad articulada en torno al Observatorio se podrán calcular indicadores de vulnerabilidad al riesgo de sequía —que se han demostrado claves para su completa comprensión— y se evaluarán distintas alternativas de gestión del agua y de la sequía. Con ello no solo se genera nuevo conocimiento sino también opiniones informadas que mejorarán la calidad del debate público sobre la materia. Para facilitar y fortalecer la participación de ciudadanos, responsables de gestión, colectivos profesionales y comunidad científica, se han desarrollado nuevas herramientas basadas en tecnologías de información geográfica, aplicaciones web e inteligencia artificial.
",Observatorio de la Ciencia Ciudadana en España,https://ciencia-ciudadana.es/proyecto-cc/
«Picture your microbes – Imagina tus microbios»,https://ciencia-ciudadana.es/proyecto-cc/picture-your-microbes-imagina-tus-microbios/,"Biología, Ciencia de los Alimentos, Ciencias Químicas, Educación, Informática y Ciencias de la Computación, Medicina y Salud","Para llevar a cabo este proyecto empezaremos con una fase de reclutamiento y selección de los participantes (voluntarios). Organizaremos grupos focales que contarán con los investigadores para orientar la discusión sobre microbiota, dieta y hábitos saludables, así como el desarrollo de actividades de fotovoz.
Se analizará la microbiota de cada participante y crearemos infografías de los grupos bacterianos más representativos encontrados con el fin de discutir sus implicaciones.
Finalmente, evaluaremos el impacto en los participantes y en la comunidad.
","“Picture your Microbes” es un proyecto de participación pública, con el objetivo principal de empoderar a los ciudadanos con factores de riesgo para desarrollar enfermedades no transmisibles, particularmente aquellas personas que viven con sobrepeso u obesidad, creando conciencia sobre la importancia de cuidar las comunidades bacterianas (microbioma) que viven en nuestros cuerpos.","“Picture your Microbes” es un proyecto de participación pública, con el objetivo principal de empoderar a los ciudadanos con factores de riesgo para desarrollar enfermedades no transmisibles, particularmente aquellas personas que viven con sobrepeso u obesidad, creando conciencia sobre la importancia de cuidar las comunidades bacterianas (microbioma) que viven en nuestros cuerpos.Para llevar a cabo este proyecto empezaremos con una fase de reclutamiento y selección de los participantes (voluntarios). Organizaremos grupos focales que contarán con los investigadores para orientar la discusión sobre microbiota, dieta y hábitos saludables, así como el desarrollo de actividades de fotovoz.
Se analizará la microbiota de cada participante y crearemos infografías de los grupos bacterianos más representativos encontrados con el fin de discutir sus implicaciones.
Finalmente, evaluaremos el impacto en los participantes y en la comunidad.
",Observatorio de la Ciencia Ciudadana en España,https://ciencia-ciudadana.es/proyecto-cc/
Proyecto de Voluntariado Hippocampus,https://ciencia-ciudadana.es/proyecto-cc/proyecto-de-voluntariado-hippocampus/,"Biodiversidad, Biología, Ecología y Medioambiente, Océanos, Agua, Marino y Terrestre","La búsqueda de las poblaciones de caballitos en el Mar Menor se realizará por medio de buceo con escafandra autónoma, ya que a una profundidad superior al medio metro la capacidad de detectar a los ejemplares disminuye de forma considerable. La profundidad máxima del Mar Menor está sondada a 6,9 metros. Los voluntarios que llevan a cabo esta actividad, son una red de voluntarios formados y muchos de ellos ya fidelizados a lo largo de todos estos años y coordinados por personal científico y con conocimientos sobre la materia
","En el 2007, la Asociación Hippocampus, ante el desconocimiento prácticamente total de la biología y ecología del caballito de mar (Hippocampus guttulatus) en el Mar Menor, se puso de manifiesto la necesidad de abordar una serie de estudios destinados a recabar la máxima información posible sobre esta especie, para poder desarrollar en un futuro próximo toda una serie de medidas de gestión destinadas a la recuperación de la especie y/o la introducción de medidas paliativas que evitasen su total desaparición de acuerdo con la legislación vigente","En el 2007, la Asociación Hippocampus, ante el desconocimiento prácticamente total de la biología y ecología del caballito de mar (Hippocampus guttulatus) en el Mar Menor, se puso de manifiesto la necesidad de abordar una serie de estudios destinados a recabar la máxima información posible sobre esta especie, para poder desarrollar en un futuro próximo toda una serie de medidas de gestión destinadas a la recuperación de la especie y/o la introducción de medidas paliativas que evitasen su total desaparición de acuerdo con la legislación vigenteLa búsqueda de las poblaciones de caballitos en el Mar Menor se realizará por medio de buceo con escafandra autónoma, ya que a una profundidad superior al medio metro la capacidad de detectar a los ejemplares disminuye de forma considerable. La profundidad máxima del Mar Menor está sondada a 6,9 metros. Los voluntarios que llevan a cabo esta actividad, son una red de voluntarios formados y muchos de ellos ya fidelizados a lo largo de todos estos años y coordinados por personal científico y con conocimientos sobre la materia
",Observatorio de la Ciencia Ciudadana en España,https://ciencia-ciudadana.es/proyecto-cc/
AquaCoLab – Burgos (FCT – 19 – 15215),https://ciencia-ciudadana.es/proyecto-cc/aquacolab-burgos-fct-19-15215/,"Animales, Biodiversidad, Biología, Ciencias Químicas, Ecología y Medioambiente, Educación, Geología y Ciencias de la Tierra, Gestión de Recursos Naturales, Insectos y Polinizadores, Naturaleza y Aire Libre, Océanos, Agua, Marino y Terrestre, Pájaros, Seguimiento de Especies a largo plazo","En el proyecto AquaCoLab se implementa una metodología denominada KEEA (kit de estudio de los ecosistemas acuáticos) mediante la cual los ciudadanos y ciudadanas científicas evaluan la calidad ambiental de estos ecosistemas mediante el registro de determinados parámetros con diferentes plataformas de ciencia ciudadana e instrumentos científicos:
- Registro de la biodiversidad del ecosistema acuático y la presencia de especies exóticas invasoras mediante guías, toma de fotos y la herramienta digital del proyecto Observation.org (www.observation.org)
- Calidad del estado hidrológico, hidromorfológico y biológico asi como su estado ecológico y cumplimiento de la Directiva Marco europea del agua mediante la herramienta de ciencia ciudadana
  RiuNet (http://www.ub.edu/fem/index.php/ca/inici-riunet).
- Registro de las barreras (azudes, presas…) que afectan a la conectividad fluvial del río a través del proyecto europeo AMBER (https://portal.amber.international/)
- Registro y caracterización de la basura y residuos presentes en el ecosistema con https://elitter.org/
- Medición de las condiciones químicas y fisicoquímicas generales (oxígeno disuelto, nutrientes y pH) mediante colorimetría (tiras colorimétricas muy sencillas de usar).
- Determinación de diversas sustancias que afectan a la calidad del agua (hierro, aluminio, fenoles) mediante unos novedosos bio-sensores desarrollados por el grupo de investigación POLYMERS de
  la Universidad de Burgos.
","El proyectoAquaCoLab es un proyecto de Ciencia Ciudadana ambiental de la Universidad de Burgos (UBU), desarrollado por la Oficina Verde (UBUverde) y con la colaboración de la Fundación Española para la Ciencia y la Tecnología - Ministerio de Ciencia e Innovación. 

El principal objetivo es implementar una metodología de participación ciudadana para el monitoreo de la calidad de los sistemas de agua dulce a través de laboratorios colaborativos (CoLabs: sociedad en general, asociaciones, ayuntamientos, colegios, universidad etc) usando diferentes plataformas de ciencia ciudadana, que permitan:

1) obtener un mapa colaborativo de calidad ambiental de los sistemas de agua dulce de la provincia de Burgos.

2) incrementar la cultura científica ayudando a mejorar el conocimiento, la valoración ambiental y una innovación responsable de los sistemas de agua dulce.

3) impulsar y mejorar la participación activa de la sociedad en el estudio y cuidado de estos ecosistemas.","El proyectoAquaCoLab es un proyecto de Ciencia Ciudadana ambiental de la Universidad de Burgos (UBU), desarrollado por la Oficina Verde (UBUverde) y con la colaboración de la Fundación Española para la Ciencia y la Tecnología - Ministerio de Ciencia e Innovación. 

El principal objetivo es implementar una metodología de participación ciudadana para el monitoreo de la calidad de los sistemas de agua dulce a través de laboratorios colaborativos (CoLabs: sociedad en general, asociaciones, ayuntamientos, colegios, universidad etc) usando diferentes plataformas de ciencia ciudadana, que permitan:

1) obtener un mapa colaborativo de calidad ambiental de los sistemas de agua dulce de la provincia de Burgos.

2) incrementar la cultura científica ayudando a mejorar el conocimiento, la valoración ambiental y una innovación responsable de los sistemas de agua dulce.

3) impulsar y mejorar la participación activa de la sociedad en el estudio y cuidado de estos ecosistemas.En el proyecto AquaCoLab se implementa una metodología denominada KEEA (kit de estudio de los ecosistemas acuáticos) mediante la cual los ciudadanos y ciudadanas científicas evaluan la calidad ambiental de estos ecosistemas mediante el registro de determinados parámetros con diferentes plataformas de ciencia ciudadana e instrumentos científicos:
- Registro de la biodiversidad del ecosistema acuático y la presencia de especies exóticas invasoras mediante guías, toma de fotos y la herramienta digital del proyecto Observation.org (www.observation.org)
- Calidad del estado hidrológico, hidromorfológico y biológico asi como su estado ecológico y cumplimiento de la Directiva Marco europea del agua mediante la herramienta de ciencia ciudadana
  RiuNet (http://www.ub.edu/fem/index.php/ca/inici-riunet).
- Registro de las barreras (azudes, presas…) que afectan a la conectividad fluvial del río a través del proyecto europeo AMBER (https://portal.amber.international/)
- Registro y caracterización de la basura y residuos presentes en el ecosistema con https://elitter.org/
- Medición de las condiciones químicas y fisicoquímicas generales (oxígeno disuelto, nutrientes y pH) mediante colorimetría (tiras colorimétricas muy sencillas de usar).
- Determinación de diversas sustancias que afectan a la calidad del agua (hierro, aluminio, fenoles) mediante unos novedosos bio-sensores desarrollados por el grupo de investigación POLYMERS de
  la Universidad de Burgos.
",Observatorio de la Ciencia Ciudadana en España,https://ciencia-ciudadana.es/proyecto-cc/
Fundesplai,https://ciencia-ciudadana.es/proyecto-cc/fundesplai/,"Ciencia de los Alimentos, Ciencias Sociales, Ecología y Medioambiente, Educación","Fundesplai es una entidad sin ánimo de lucro que desde hace más de 50 años trabaja en favor de los niños y niñas, la juventud, las familias y
el tercer sector social, con la finalidad educativa y de mejorar el medio ambiente y promover la ciudadanía y la inclusión social, con voluntad transformadora.
Fundesplai desarrolla proyectos y programas de educación ambiental y de capacitación de las personas para actuar en favor de un mundo más justo y sostenible, desarrolla talleres de educación ambiental en escuelas, gestiona escuelas de naturaleza y centros de información ambiental, realiza proyectos de voluntariado ambiental y campos de trabajo, etc. En estas actividades y con sus beneficiarios (niños, niñas y jóvenes), Fundesplai impulsa y participa en proyectos de ciencia ciudadana ya existentes, con el objetivo de fomentar el compromiso de niños, niñas y jóvenes en la transformación de su entorno.
Por otro lado, Fundesplai impulsa la educación crítica, sistémica (que tenga en cuenta la globalidad de las soluciones) y colaborativa. Para ello estudia, analiza, difunde y promueve metodologías y herramientas pedagógicas que fomenten la participación ciudadana y el compromiso de niños, niñas y jóvenes en la transformación de su entorno, como es el caso de la ciencia ciudadana. Fundesplai recopila y elabora recursos pedagógicos que faciliten la participación en proyectos de ciencia ciudadana con una mirada particular hacia los educadores de espacios formales y no formales. En esta línea, se ha publicado una guía sobre educación ambiental y ciencia ciudadana y diversas recopilaciones de recursos pedagógicos.
","Fundesplai promueve la ciencia ciudadana en el ámbito educativo como herramienta de sensibilización, participación y transformación social. Lo hace a través de dos vertientes: la participación directa en iniciativas y proyectos existentes, y el análisis y difusión de su potencial educativo.","Fundesplai promueve la ciencia ciudadana en el ámbito educativo como herramienta de sensibilización, participación y transformación social. Lo hace a través de dos vertientes: la participación directa en iniciativas y proyectos existentes, y el análisis y difusión de su potencial educativo.Fundesplai es una entidad sin ánimo de lucro que desde hace más de 50 años trabaja en favor de los niños y niñas, la juventud, las familias y
el tercer sector social, con la finalidad educativa y de mejorar el medio ambiente y promover la ciudadanía y la inclusión social, con voluntad transformadora.
Fundesplai desarrolla proyectos y programas de educación ambiental y de capacitación de las personas para actuar en favor de un mundo más justo y sostenible, desarrolla talleres de educación ambiental en escuelas, gestiona escuelas de naturaleza y centros de información ambiental, realiza proyectos de voluntariado ambiental y campos de trabajo, etc. En estas actividades y con sus beneficiarios (niños, niñas y jóvenes), Fundesplai impulsa y participa en proyectos de ciencia ciudadana ya existentes, con el objetivo de fomentar el compromiso de niños, niñas y jóvenes en la transformación de su entorno.
Por otro lado, Fundesplai impulsa la educación crítica, sistémica (que tenga en cuenta la globalidad de las soluciones) y colaborativa. Para ello estudia, analiza, difunde y promueve metodologías y herramientas pedagógicas que fomenten la participación ciudadana y el compromiso de niños, niñas y jóvenes en la transformación de su entorno, como es el caso de la ciencia ciudadana. Fundesplai recopila y elabora recursos pedagógicos que faciliten la participación en proyectos de ciencia ciudadana con una mirada particular hacia los educadores de espacios formales y no formales. En esta línea, se ha publicado una guía sobre educación ambiental y ciencia ciudadana y diversas recopilaciones de recursos pedagógicos.
",Observatorio de la Ciencia Ciudadana en España,https://ciencia-ciudadana.es/proyecto-cc/
WeCount – Ciencia ciudadana para contabilizar la movilidad,https://ciencia-ciudadana.es/proyecto-cc/wecount/,"Ecología y Medioambiente, Transporte","WeCount es el piloto en España de un proyecto europeo que tiene como objetivo contabilizar y medir la movilidad en las ciudades. Más de 200 vecinos y comunidades ciudadanas de Madrid y Barcelona instalarán en sus ventanas unos sensores automáticos para recolectar a tiempo real datos sobre cuántos coches, vehículos pesados, bicicletas y peatones pasan por las calles, y a qué velocidad.
La iniciativa, impulsada por Ideas for Change y otros seis socios europeos y respaldada por la Comisión Europea, se desarrollará de manera paulatina en cinco países de Europa (Bélgica, Eslovenia, Irlanda, Gales y España). Se espera que los datos recogidos proporcionen una escala temporal y espacial más rigurosa y contrastada que las campañas clásicas de conteo de tráfico. Asimismo, el proyecto busca codiseñar junto a los ciudadanos soluciones informadas que aborden los desafíos de la movilidad.
Los sensores, llamados Telraam, contienen una microcomputadora Raspberry Pi y una cámara de baja resolución. Los datos recogidos se procesan en el propio dispositivo y se envían a una central de datos que los visualiza en una plataforma abierta. Toda la información recogida cumple escrupulosamente con las políticas de privacidad, ya que el sensor nunca graba imágenes, sino que, a través de un algoritmo, reconoce el tamaño y la velocidad de los elementos, y los clasifica entre camiones, coches, bicicletas y peatones. Para que el sensor mida de manera correcta, la ventana debe tener una buena vista de la calle.
",WeCount es un proyecto europeo de ciencia ciudadana para monitorizar y medir la movilidad en la ciudad. Tenemos una clara misión: empoderar a la ciudadanía para informar políticas públicas en diseño urbano y movilidad.,"WeCount es un proyecto europeo de ciencia ciudadana para monitorizar y medir la movilidad en la ciudad. Tenemos una clara misión: empoderar a la ciudadanía para informar políticas públicas en diseño urbano y movilidad.WeCount es el piloto en España de un proyecto europeo que tiene como objetivo contabilizar y medir la movilidad en las ciudades. Más de 200 vecinos y comunidades ciudadanas de Madrid y Barcelona instalarán en sus ventanas unos sensores automáticos para recolectar a tiempo real datos sobre cuántos coches, vehículos pesados, bicicletas y peatones pasan por las calles, y a qué velocidad.
La iniciativa, impulsada por Ideas for Change y otros seis socios europeos y respaldada por la Comisión Europea, se desarrollará de manera paulatina en cinco países de Europa (Bélgica, Eslovenia, Irlanda, Gales y España). Se espera que los datos recogidos proporcionen una escala temporal y espacial más rigurosa y contrastada que las campañas clásicas de conteo de tráfico. Asimismo, el proyecto busca codiseñar junto a los ciudadanos soluciones informadas que aborden los desafíos de la movilidad.
Los sensores, llamados Telraam, contienen una microcomputadora Raspberry Pi y una cámara de baja resolución. Los datos recogidos se procesan en el propio dispositivo y se envían a una central de datos que los visualiza en una plataforma abierta. Toda la información recogida cumple escrupulosamente con las políticas de privacidad, ya que el sensor nunca graba imágenes, sino que, a través de un algoritmo, reconoce el tamaño y la velocidad de los elementos, y los clasifica entre camiones, coches, bicicletas y peatones. Para que el sensor mida de manera correcta, la ventana debe tener una buena vista de la calle.
",Observatorio de la Ciencia Ciudadana en España,https://ciencia-ciudadana.es/proyecto-cc/
Plataforma MARNOBA-Caracterización de Basuras Marinas,https://ciencia-ciudadana.es/proyecto-cc/plataforma-marnoba/,"Ecología y Medioambiente, Naturaleza y Aire Libre, Océanos, Agua, Marino y Terrestre","Plataforma MARNOBA está en funcionamiento desde 2013 gracias al apoyo de la Fundación Biodiversidad del MITERD, consiste en una aplicación móvil de libre descarga (MARNOBA) en la que el ciudadano puede enviar la caracterización de los residuos que encuentra en playas, actividades de buceo, pesca de arrastre y navegación en general (flotantes). Estos datos alimentan una base de datos que puede ser consultada a través del Visor MARNOBA (https://marnoba.vertidoscero.com/collections). Anualmente estos datos son analizados, validados y enviados al programa de seguimiento de basuras marinas del MITERD (sección datos adicionales) y al programa Marine LitterWatch de la Agencia Europea de Medioambiente. Plataforma MARNOBA sirve además como herramienta de toma de datos de diferentes proyectos nacionales e internacionales.
","Gracias a los datos aportados por los ciudadanos a través de una aplicación para dispositivos móviles podemos completar la información sobre basuras marinas, para avanzar en la búsqueda de soluciones a este problema.","Gracias a los datos aportados por los ciudadanos a través de una aplicación para dispositivos móviles podemos completar la información sobre basuras marinas, para avanzar en la búsqueda de soluciones a este problema.Plataforma MARNOBA está en funcionamiento desde 2013 gracias al apoyo de la Fundación Biodiversidad del MITERD, consiste en una aplicación móvil de libre descarga (MARNOBA) en la que el ciudadano puede enviar la caracterización de los residuos que encuentra en playas, actividades de buceo, pesca de arrastre y navegación en general (flotantes). Estos datos alimentan una base de datos que puede ser consultada a través del Visor MARNOBA (https://marnoba.vertidoscero.com/collections). Anualmente estos datos son analizados, validados y enviados al programa de seguimiento de basuras marinas del MITERD (sección datos adicionales) y al programa Marine LitterWatch de la Agencia Europea de Medioambiente. Plataforma MARNOBA sirve además como herramienta de toma de datos de diferentes proyectos nacionales e internacionales.
",Observatorio de la Ciencia Ciudadana en España,https://ciencia-ciudadana.es/proyecto-cc/
